<?xml version="1.0" encoding="ISO-8859-1"?>
<filter  xmlns:xsi="http://www.w3.org/2001/XMLSchema-instance"
         xsi:noNamespaceSchemaLocation="filter.xsd">
    
    <exclusion-List  module-name="ExclusionFilter" 
                     parser-class="com.sun.mdm.index.filter.ExclusionFilterCofig" >
        
        <!-- Default list of value for all  sbr ,matching & blockings -->


        
        <field  sbr="true" matching="true" blocking="true" >
            <name>PatientView.FirstName</name>
            <value>
                <field-value>bill</field-value>
                <field-value>bills</field-value>
                <field-value>block</field-value>
                <field-value>match</field-value>
                <field-value>baby</field-value>
                <field-value>boby</field-value>
                <field-value>nirmal</field-value>
                <field-value>niru</field-value>
                <field-value>nishanth</field-value>
                <field-value>nisha</field-value>
                <field-value>deep</field-value>
                <field-value>sami</field-value>
            </value>
        </field>
        
        <field  sbr="true" matching="false" blocking="true" >
            <name>PatientView.LastName</name>
            <value>
                <file  delimiter=";">
                    <file-name>exclusionValues.txt</file-name> 
                </file>
            </value>
        </field>
        
        <field sbr="true" matching="true" blocking="false">
            <name>PatientView.SSN</name>
            <value>
                <file delimiter="|"> 
                    <file-name>matching.txt</file-name> 
                </file>
            </value>
        </field>  
        
        
        
        
        
    </exclusion-List>
</filter>
